{
  "entity_type": "prompt",
  "schema_version": "1.0.0",
  "prompt_id": "P18",
  "prompt_version": "1.0.0",
  "prompt_text": "What does LOCATRIA do for local businesses?",
  "prompt_category": "BRANDED",
  "intent_type": "BRANDED_DISCOVERY",
  "language": "en",
  "status": "ACTIVE",
  "created_at": "2026-09-27T00:00:00Z",
  "retired_at": null,
  "notes": "Frozen historical benchmark prompt P18 in PSET-M08-1-FIXED20."
}