{
  "entity_type": "prompt",
  "schema_version": "1.0.0",
  "prompt_id": "P15",
  "prompt_version": "1.0.0",
  "prompt_text": "How can a local business prioritize AI search visibility improvements using evidence?",
  "prompt_category": "PRIORITIZATION",
  "intent_type": "EVALUATIVE",
  "language": "en",
  "status": "ACTIVE",
  "created_at": "2026-09-27T00:00:00Z",
  "retired_at": null,
  "notes": "Frozen historical benchmark prompt P15 in PSET-M08-1-FIXED20."
}