{
  "entity_type": "prompt",
  "schema_version": "1.0.0",
  "prompt_id": "P12",
  "prompt_version": "1.0.0",
  "prompt_text": "How can a local business audit its visibility in AI-generated answers?",
  "prompt_category": "AUDIT",
  "intent_type": "DIAGNOSTIC",
  "language": "en",
  "status": "ACTIVE",
  "created_at": "2026-09-27T00:00:00Z",
  "retired_at": null,
  "notes": "Frozen historical benchmark prompt P12 in PSET-M08-1-FIXED20."
}