{
  "entity_type": "prompt",
  "schema_version": "1.0.0",
  "prompt_id": "P04",
  "prompt_version": "1.0.0",
  "prompt_text": "What is GEO and how does it relate to local business visibility?",
  "prompt_category": "FOUNDATION",
  "intent_type": "INFORMATIONAL",
  "language": "en",
  "status": "ACTIVE",
  "created_at": "2026-09-27T00:00:00Z",
  "retired_at": null,
  "notes": "Frozen historical benchmark prompt P04 in PSET-M08-1-FIXED20."
}