{
  "entity_type": "prompt",
  "schema_version": "1.0.0",
  "prompt_id": "P03",
  "prompt_version": "1.0.0",
  "prompt_text": "How is AI visibility different from local SEO?",
  "prompt_category": "COMPARISON",
  "intent_type": "COMPARATIVE",
  "language": "en",
  "status": "ACTIVE",
  "created_at": "2026-09-27T00:00:00Z",
  "retired_at": null,
  "notes": "Frozen historical benchmark prompt P03 in PSET-M08-1-FIXED20."
}