{
  "entity_type": "prompt",
  "schema_version": "1.0.0",
  "prompt_id": "P06",
  "prompt_version": "1.0.0",
  "prompt_text": "How do you measure whether a local business appears in AI search results?",
  "prompt_category": "MEASUREMENT",
  "intent_type": "EVALUATIVE",
  "language": "en",
  "status": "ACTIVE",
  "created_at": "2026-09-27T00:00:00Z",
  "retired_at": null,
  "notes": "Frozen historical benchmark prompt P06 in PSET-M08-1-FIXED20."
}