{
  "entity_type": "prompt",
  "schema_version": "1.0.0",
  "prompt_id": "P11",
  "prompt_version": "1.0.0",
  "prompt_text": "How can a business test whether ChatGPT knows about its local brand?",
  "prompt_category": "AUDIT",
  "intent_type": "DIAGNOSTIC",
  "language": "en",
  "status": "ACTIVE",
  "created_at": "2026-09-27T00:00:00Z",
  "retired_at": null,
  "notes": "Frozen historical benchmark prompt P11 in PSET-M08-1-FIXED20."
}